,DSI_Title,Text,category
32,XL_Doc1_Secret-life-Pets.docx,"“The Secret Life of Pets” is a kind-hearted, sweet story about the unique relationship not only between pets and their owners but between pets and major cities like New York. It may open with lovable terrier Max (voiced by Louis C.K.) speeding through Central Park in the basket of his owner Katie’s (Ellie Kemper) bike, but it’s more about apartments, fire escapes, roads and sewers than parks, and how a lovable group of animals is forced to traverse them on one crazy day. To be more direct, it’s an almost beat-for-beat rip of Pixar’s “Toy Story,” from the idea that we don’t know what our toys/pets do while we’re gone to the “new guy who mixes things up” storytelling dynamic. In the end, it’s too aggressively likable to hate—especially given its strong character design and excellent voice work—but simultaneously too shallow and forgettable to really register. The best animated movies give us themes to discuss with our kids when they’re over and work for both adults and children. “The Secret Life of Pets” is the disposable, summer diversion that many families will be looking for as temperatures rise and the start of school seems so far away, but most won’t be able to remember after they see it.



Max narrates this story of the day that his owner got a second dog, a big hairball known as Duke (Eric Stonestreet)—and the visual offset between tiny Max and giant Duke offers a Laurel & Hardy charm that I wish the movie played with more. When Max decides he’s not ready to share space and vie for Andy’s, I mean, Katie’s love, he tries to frame Duke for destroying their owner’s apartment. Before you know it, Max and Duke are on the street, hoping to avoid both animal control and a group of sewer-dwelling “flushed” pets who are organizing a revolution against the humans, led by the scene-stealing bunny named Snowball (a great, energetic turn by Kevin Hart). 

The pampered dog named Gidget (Jenny Slate, who I'd like to do voice work in every major animated from now on if at all possible) happens to notice that the object of her affection in the apartment across the way (Max) is missing and leads a posse to find him that’s made up of other house pets from nearby flats, including temperamental cat Chloe (Lake Bell), hyperactive dog Mel (Bobby Moynihan) and even a hawk named Tiberius (Albert Brooks), forced to fight his instinct to eat every animal with whom he’s now aligned. “The Secret Life of Pets” is an adventure tale, a story of two dogs trying to find their way home while their friends come to the rescue.

And yet there’s not much adventure to it. At a certain point, one realizes that “The Secret Life of Pets” doesn’t really have a lot of story, cramming so many characters into its brief 90-minute running time that they’re not given much to do.",0
33,TJ_Doc2_ESOTSM.docx,"On March 9, 2004, Eternal Sunshine of the Spotless Mind, starring Jim Carrey and Kate Winslet, premiered in Los Angeles. The film went on to win an Oscar at the 77th Academy Awards for Charlie Kaufman's original screenplay. The Hollywood Reporter's original review is below.

Charlie Kaufman has finally nailed that elusive third act.

The concepts for his mind-expanding screenplays for Being John Malkovich, Human Nature, Confessions of a Dangerous Mind and Adaptation were all audacious and original, but the movies were running on fumes at the end. For Kaufman, the devil was in the details of finding his way out of the cerebral maze in which he isolated his characters. 

Eternal Sunshine of the Spotless Mind is not only his most accessible and romantic screenplay, it's his most complete. The third act works like a charm and pulls all his themes, characters and conflicts together beautifully.

The film will appeal to Jim Carrey fans and women drawn by Kate Winslet, but there will be a strong core audience of young and older adults who can't wait to see the latest Kaufman brain-tickler. None will be disappointed. Focus Features should enjoy above-average box office for this spotless confection.

The references to the mind and brain in the preceding paragraphs are apt because the movie basically takes place in the mind of Joel Barish (Carrey). Barish knows his relationship with live-in girlfriend Clementine (Winslet) is unraveling, but he gets the shock of his life when he learns that she has had her memory of him completely erased from her mind. Rushing to see the inventor of this process, Dr. Howard Mierzwiak (Tom Wilkinson), he impulsively decides to undergo the procedure, too.

Director Michel Gondry, a French music video director who made his directorial debut with Kaufman's Human Nature, beautifully orchestrates Ellen Kuras' cinematography, Dan Leigh's production design and Valdis Oskarsdottir's editing so memories merge and evaporate seemingly in a single shot. Joel and Clementine move through space as the scenes behind them change and morph like animation cels gone mad.

Carrey takes all his usual antic energy and bottles it up tight to portray an anal man both attracted and repelled by Winslet's free spirit who changes her attitudes almost as frequently as her hair color. Wilkinson gives the doctor such a calm intelligence that you almost forget what an appalling device he has invented. Ruffalo is goofy and unthinking, while Wood's puppy love for a former patient has a genuinely nasty side, the equivalent of psychological rape. Dunst is deep into hero worship of all the scientists, especially Wilkinson's gentle guru, without realizing the implications of that hero worship.

For all its science fiction plot, Eternal Sunshine is no special-effects extravaganza. The emphasis is always on the characters, their hearts and minds",1
34,AEJ_Doc2_How_to_Train.docx,"“How to Train Your Dragon” may not be the most beloved of computer-animated franchises, but it is one of the most reliable. “How to Train Your Dragon: The Hidden World,” gives the now-trilogy a pleasing arc.

In the first movie (2010), Hiccup (voiced by Jay Baruchel), through a secret friendship with a not-so-fearsome dragon, Toothless, broke with centuries of Viking tradition to bring about a cease-fire (and cease-firebreathing) in human-dragon affairs. In “How to Train Your Dragon 2” (2014), Hiccup refined his leadership skills, ending the movie as a worthy successor to his father, Stoick (Gerard Butler), the chief of Berk, and his mother, Valka (Cate Blanchett), a pioneer in dragon whispering.



More bittersweet and less triumphal than its predecessors, and directed by a returning Dean DeBlois, “The Hidden World” concerns the exigencies that Hiccup faces as a leader, both politically and personally. If you truly love that dragon you trained, its message says, let him go.

As the movie opens, Berk is, in Hiccup’s estimation, “the world’s first dragon-Viking utopia.” But it’s not so utopian: Overcrowding is a problem at mealtimes, and the high concentration of rescued dragons in the settlement has made Berk a target for hunters. The most fearsome of those is a new villain, Grimmel (F. Murray Abraham, chewing on the cartoon scenery), who lives for the thrill of the chase and is always one step ahead of Berk’s peace-loving populace.

Should the residents hold strong, or must they abandon their centuries-old home? Is Berk just a state of mind? And is Hiccup finally ready for marriage with Astrid (America Ferrera)? Toothless, thought to be the last of his breed, meets a female counterpart and is quickly smitten. But is she on the level, or is Grimmel, who has Toothless in his sights, using her as bait?

Never the most sophisticated of digital dynasties, plot-wise, “How to Train Your Dragon” makes the most of these questions. If you’ve spent any time with these characters, it’s hard not to get swept up in the saga, and it’s easy to be moved by the bond between Hiccup and Toothless, who is, in effect, a very loyal dog who can fly and harness the power of lightning bolts.

The skill and detail with which the dragons have been rendered has only improved over the three films, and in sheer numbers, “The Hidden World” probably offers the most dragons per minute. The hidden world of the title — which Hiccup is searching for — is their secret ancestral homeland, depicted in glowing pastels that suggest a geological kinship with Pandora from “Avatar.”

But mostly the movie aspires to be goofy fun. Hiccup plays Cyrano during Toothless’s mating dance with his mysterious lady-dragon friend. Several former Judd Apatow associates (Jonah Hill, Kristen Wiig, Christopher Mintz-Plasse) are back as comic relief, although you suspect that some of them — along with Kit Harrington as a reformed dragon hunter and Butler — stopped by the recording studio only briefly. And unusually for a sequel, this installment has the courage to feel conclusive. The series has earned affection for its characters and its disarming premise.",0
35,SXN_Doc1_Hidden Figures.docx,"Vaughan is one of the three real-life African-American women who helped decipher and define the mathematics used during the space race in the 1960s. Theodore Melfi knows when to let a visual cue or cut tell the story, building on moments of repetition before paying off with scenes of great power. For example, the absurdity of segregated bathrooms, Melfi repeats shots of a nervously tapping foot, followed by mile-long runs to the only available bathroom. This running joke culminates in a brilliantly acted, angry speech by Taraji Henson that is her finest cinematic moment to date. 

Henson plays Katherine Johnson, a mathematician who, in the film’s opening flashback, is shown to have a preternatural affinity for math in her youth. Her success at obtaining the education she needs is hindered by Jim Crow, but she still manages to earn degrees in math and a job at NASA’s “Colored Computer” division. In an attempt to beat Russia to the moon, NASA has been looking for the nation’s best mathematicians. The importance of the space race forces them to accept qualified candidates of any stripe, including those society would normally discourage.

The dialogue between the three women establishes their easy rapport with one another, and introduces their personalities. Vaughan is no-nonsense, Jackson is a wise ass with impeccable comic timing and Johnson is the clever optimist. They are similarly educated, though each has their own skill set the film will explore. The fears and oppressions of this era are omnipresent even when we don’t see them, and the film develops a particular rhythm between problems and solutions that is cathartic without feeling forced.

At the request of Vaughan’s supervisor (Kirsten Dunst), Johnson is sent to a room full of White male mathematicians to assist in some literal rocket science. The calculations have stumped everyone, including Paul Stafford (Jim Parsons), the hotshot whose math Johnson is hired to check. Parsons is a bit of a weak link here—his petulance, while believable, is overplayed but the overall attitude in the room made me shudder with bad memories of my own early career tribulations. I’ve been the only person of color in a less than inviting work environment, and many of Henson’s delicate acting choices vis-à-vis her body language held the eerie feeling of sense memory for me. Though she remains confident in her work and presents that confidence whenever questioned, Henson manifests on her person every hit at her dignity. You can see her trying to hold herself in check instead of going full-Cookie Lyon on her colleagues.

In addition to the unwelcome men in the room, Johnson also has to deal with the tough, though fair complaints of her grizzled supervisor, Al Harrison (Kevin Costner). He and Henson play off each other with an equal sense of bemusement, and when the film gives him something noble to do, it hides the cliché under the nostalgic sight of “Bull Durham”'s Crash Davis holding a baseball bat.

While Johnson tries to keep John Glenn (charmingly played by Glen Powell) from exploding atop a rocket and Vaughan fights FORTRAN and Dunst for the right to be a supervisor, Janelle Monae is secretly walking off with the picture. Mary Jackson wants to be the first Black engineer at NASA, yet she’s hindered by Jim Crow practices. Jackson takes her case to court, and the scene where Monae wordlessly reacts to the outcome is one of the year’s best.",1
36,HK_Doc1_Dreams_Subconscious_Minds.docx,"Films about dreams and the subconscious are usually not very straightforward and almost always weird. ""Inception"" is no exception to that rule, but like its cinematic predecessors who have explored the contrast between and the questions of what is real and what is illusion, you really can't look away, nor should you.

""Inception"" is an excellent and breathtaking movie that may be one of the only films released so far during the Summer of 2010 that lives up to its hype. It is a nearly perfect and highly original film that holds your attention until the credits roll. The less you know about this movie going in, the more you will be entranced by seeing it.

Leonardo DiCaprio plays Dom Cobb, a world class criminal who, with the help of a team of sleep experts, works his way into people's subconscious and steals what people value most: ideas directly from their minds. In his last assignment to possibly clear his name, he is assigned not to steal an idea from someone, but to plant one inside that person's mind. The difficulty comes when certain people are trained to block their ideas from being taken.

That plot summary only covers the basics of this pretty complicated story, but to describe every plot detail would take away the magic of this film you must see yourself to believe. DiCaprio is good in his role, but unlike many other films he has starred in, this is perhaps his only role where his character alone does not carry the weight of the movie on his shoulders or share it equally with one other co-star. Instead, this great ensemble cast teams together to make this movie work, just as their characters collaborate to pull off such a unique heist. Joseph Gordon-Levitt, Ellen Page, and Tom Hardy are especially good in their roles.

The special effects in this film were also very good, which is amazing considering their simplicity compared to the ""Matrix"" movies. There are slow-motion shots, but no impossible kung fu fighting sequences. It's especially interesting when the film gets into the architecture of certain dreams, and impossible sequences are filmed in a way I've never seen other than in drawings.

However, the special effects would mean nothing if the story wasn't good. For this reason, even something as simple as a spinning top holds your attention in a way you would never think it would when seeing it in this film. The credit here can be given to writer and director Christopher Nolan, who has not made a bad film yet. There are many twists and turns in this film, but Nolan never loses his focus in the process of telling the story. If Nolan does not get nominated for Best Director and/or Best Original Screenplay next Oscar season, there is something terribly wrong with the Academy.",0
37,OS_Doc1_Finding-Nemo.docx,"""Finding Nemo"" has all of the usual pleasures of the Pixar animation style--the comedy and wackiness of ""Toy Story"" or ""Monsters Inc."" or ""A Bug's Life."" And it adds an unexpected beauty, a use of color and form that makes it one of those rare movies where I wanted to sit in the front row and let the images wash out to the edges of my field of vision. The movie takes place almost entirely under the sea, in the world of colorful tropical fish--the flora and fauna of a shallow warm-water shelf not far from Australia. The use of color, form and movement make the film a delight even apart from its story.



There is a story, though, one of those Pixar inventions that involves kids on the action level while adults are amused because of the satire and human (or fishy) comedy. The movie involves the adventures of little Nemo, a clown fish born with an undersized fin and an oversized curiosity. His father, Marlin, worries obsessively over him, because Nemo is all he has left: Nemo's mother and all of her other eggs were lost to barracudas. When Nemo goes off on his first day of school, Marlin warns him to stay with the class and avoid the dangers of the drop-off to deep water, but Nemo forgets, and ends up as a captive in the salt-water aquarium of a dentist in Sydney. Marlin swims off bravely to find his missing boy, aided by Dory, a blue tang with enormous eyes who he meets along the way.



These characters are voiced by actors whose own personal mannerisms are well known to us; I recognized most of the voices, but even the unidentified ones carried buried associations from movie roles, and so somehow the fish take on qualities of human personalities. Marlin, for example, is played by Albert Brooks as an overprotective, neurotic worrywart, and Dory is Ellen DeGeneres as helpful, cheerful and scatterbrained (she has a problem with short-term memory). The Pixar computer animators, led by writer-director Andrew Stanton, create an undersea world that is just a shade murky, as it should be; we can't see as far or as sharply in sea water, and so threats materialize more quickly, and everything has a softness of focus. There is something dreamlike about the visuals of ""Finding Nemo,"" something that evokes the reverie of scuba-diving.



When I review a movie like ""Finding Nemo,"" I am aware that most members of its primary audience do not read reviews. Their parents do, and to them and adults who do not have children as an excuse, I can say that ""Finding Nemo"" is a pleasure for grown-ups. There are jokes we get that the kids don't, and the complexity of Albert Brooks' neuroses, and that enormous canvas filled with creatures that have some of the same hypnotic beauty as--well, fish in an aquarium. They may appreciate another novelty: This time the dad is the hero of the story, although in most animation it is almost always the mother.",0
38,SXN_Doc2_Hidden Figures (NYT).docx,"“Hidden Figures” takes us back to 1961, when racial segregation and workplace sexism were widely accepted facts of life and the word “computer” referred to a person, not a machine. Though a gigantic IBM mainframe does appear in the movie — big enough to fill a room and probably less powerful than the phone in your pocket — the most important computers are three African-American women who work at NASA headquarters in Hampton, Va. Assigned to data entry jobs and denied recognition or promotion, they would go on to play crucial roles in the American space program.

Based on Margot Lee Shetterly’s nonfiction book of the same title, the film, directed by Theodore Melfi (who wrote the script with Allison Schroeder), turns the entwined careers of Katherine Goble (Johnson), Mary Jackson and Dorothy Vaughan into a rousing celebration of merit rewarded and perseverance repaid. Like many movies about the overcoming of racism, it offers belated acknowledgment of bravery and talent and an overdue reckoning with the sins of the past. Mr. Melfi, trusts his own skill, the intrinsic interest of the material and — above all — the talent and dedication of the cast. From one scene to the next, you may know more or less what is coming, but it is never less than delightful to watch these actors at work.

Start with the three principals, whose struggles at NASA take place as the agency is scrambling to send an astronaut into orbit. Katherine Goble is the central hidden figure, a mathematical prodigy played with perfect nerd charisma by Taraji P. Henson. Katherine is plucked from the computing room and assigned to a team that will calculate the launch coordinates and trajectory for an Atlas rocket. She receives a cold welcome — particularly from an engineer named Paul Stafford (Jim Parsons) — and is not spared the indignities facing a black woman in a racially segregated, gender-stratified workplace. The only bathroom she is allowed to use is in a distant building, and she horrifies her new co-workers when she helps herself to a cup of coffee.

Dorothy (Octavia Spencer) and Mary (Janelle Monáe) also face discrimination. Dorothy, who is in charge of several dozen computers, is repeatedly denied promotion to supervisor and treated with condescension by her immediate boss (Kirsten Dunst). The Polish-born engineer (Olek Krupa) with whom Mary works is more enlightened, but Mary runs into the brick wall of Virginia’s Jim Crow laws when she tries to take graduate-level physics courses.

“Hidden Figures” effectively conveys the poisonous normalcy of white supremacy, and the main characters’ determination to pursue their ambitions in spite of it and to live normal lives in its shadow. The racism they face does not depend on the viciousness or virtue of individual white people, and for the most part the white characters are not treated as heroes for deciding, at long last, to behave decently. Two of them, however, are singled out for commendation: John Glenn, portrayed by Glen Powell as a natural democrat with no time for racial hierarchies; and Al Harrison, the head of Katherine’s group, for whom the success of the mission is more important than color.

Kevin Costner, who plays Al, with the flattop haircut and heavy-framed glasses, gives Al an aura of midcentury no-nonsense masculine competence. He desegregates the NASA bathrooms with a sledgehammer and stands up for Katherine in quieter but no less emphatic ways when her qualifications are challenged.",1
39,CEM_Doc2_Just_Go_With.docx,"The people in this movie are dumber than a box of Tinkertoys. One fears they're so unfortunate it's not Politically Correct to laugh at them. That's not a problem because ""Just Go With It"" is so rarely funny. Here is a story that began as a French farce. Then it was adapted into a Broadway play named ""Cactus Flower."" Then the play was made into a movie. Now it has been made into another movie. This process has diluted it like a homeopathic medicine, so that not an atom of the original formula can be found.

Consider. Danny (Adam Sandler) broke off his wedding at the last minute, but continues to wear the wedding ring. Women find the ring seductive, and cannot resist having sex with a married man. Therefore, most (not all) of the women in his life are stupid. This works for him for approximately 25 years. In the meantime, he becomes a famous plastic surgeon in Beverly Hills. He is assisted by Nurse Katherine (Jennifer Aniston), who has two kids.

On the one day he isn't wearing his ring, he spends an idyllic night in the beach with the delicious 23-year-old Palmer (Brooklyn Decker). Then she finds the ring in his pocket and thinks he is married, and he lies and says yes, but his divorce is almost final. She insists on meeting his wife. He makes Nurse Katherine pretend to be his wife. He buys her several thousand dollars worth of clothes for her one (1) meeting with Palmer.

For reasons having to do with Palmer's love of children, they all fly to Hawaii together with Nurse Katherine's two kids and Danny's high school buddy Eddie (Nick Swardson), who pretends to be the Nurse's fiancé. Eddie disguises himself with thick glasses and the worst German accent since the guy who worshipped Hitler in ""The Producers."" He also brandishes a meerschaum pipe, because everyone who has seen ""Inglourious Basterds"" knows all Germans smoke meerschaum pipes.

This might work as a farce. Maybe it did, in France. It worked as a Broadway play by Abe Burrows. It worked as a 1969 movie with Walter Matthau, Ingrid Bergman as the nurse and Goldie Hawn as the young girl. It doesn't work now. The problem is the almost paralytic sweetness of the characters. Nobody is really trying to get away with anything. They're just trying to do the right thing in an underhanded way. Walter Matthau was crafty in the cradle. Goldie Hawn was the definitive ditz. Ingrid Bergman was *sigh*. The 1969 screenplay was by I.A.L. Diamond, who knew a thing or two about farce when he wrote ""Some Like It Hot."" They made a good movie.

So nice is everyone here that even the completely surplus character played by Nicole Kidman is undermined. She plays the old standby, the popular girl who was mean to Nurse Katherine in high school. We know the cliché. Kidman could have done something with it, but the screenplay gives her nowhere to go It's painful to endure the cloying scene where they kiss and make up.",1
