,DSI_Title,Text,category
16,CEY_Doc2_The-Lion-King.docx,"For the uninitiated, The Lion King, is the story of Simba, a lion cub, who is dispossessed and made to feel responsible for the death of his father Mufasa, by his treacherous uncle Scar.

The cub's birth is announced in the opening sequence of the film called, ""It's the circle of life"", an evocative collaboration of music and animation that shows all animals of the African veld gathering to hail their future king. The cute little cub is held aloft from a dramatic spur of rock, and the future minions below hail him as ""the future King of Pride Rock"", in a staging that looks like the jungle equivalent of a political rally.

Of course, this coming together of all the wild beasts harps on the uncomfortable fact that many of these animals survive by eating one another. As King Mufasa tries explaining to his son, ""We are all connected to the circle of life,"" the narrative, all through the film, performs a balancing act between the fantasy of the story and the reality of the jungle.

Early scenes show Simba as a cute trusting little tyke who believes that life is beautiful. It is fun to watch him sing, in a lower and less-pantomime key, ""I just can't wait to be the king."" His enthusiasm and curiosity soon get the better of him and he lands in the wastelands, far from his kingdom. How he comes back to claim his stake as the Lion King forms the crux of the narrative.

The Shakespearean plot has dark corners, frightening moments and ancient archetypes like the crime of regicide. Some of the musical comedy numbers like, ""I can't wait to be king"", ""Circle of life"" and ""Hakuna Matata"" break the mood and are a hit among the audience, but the rest of the songs are far from memorable.

The voices of the ace star cast hit the right pitch and match the characters to perfection. Donald Glover as the grown Simba, Beyonce as his childhood friend Nala, James Earl Jones as King Mufasa, Chiwetel Ejiofor as Scar, Alfre Woodard as Simba's mother Sarabi, Seth Rogen as the Warthog Pumbaa and John Oliver as the goofy hornbill Zuzu have their moments of glory.

Visually, director Jon Favreau's The Lion King is fascinating and awe-inspiring, thanks to veteran cinematographer Caleb Deschanel, and visual effects supervisors Robert Legato and Adam Valdez, who previously collaborated on Disney's, The Jungle Book. With 3D Computer animation, each of their frames appear so realistic that the effort could pass off as a live-action film. Some scenes are just brilliant, and among the effects, the lustre of lion fur simply stands-out.

The film has all the trappings of the Disney template and is a fine remake of the studio's traditionally animated 1994 hit of the same name, nut the fact is after the initial attraction and moments of fascination in watching the extraordinarily life-like animals talking and relating to one another as human beings do, the novelty factor wears off. By mid-point the narrative meanders and the pace drags till we hear the song, ""A wee wee bum bum wae,"" which is the cover of The Tokens' 'The Lion Sleeps Tonight.' Thence, the momentum picks up. By the end, however, the predictability of the tale begins to wear you down. The 1994 edition had a run-time of 88 minutes, while this one lasts for 118 minutes. You feel the stretch.",0
17,MS_Doc2_Why I Left ‘Knives Out’ With Emotional Whiplash.docx,"Document 2:

In “Knives Out,” the writer and director Rian Johnson pays tribute to Agatha Christie and “Clue” in a star-studded whodunit that begins with the mysterious death of the wealthy author and patriarch Harlan Thrombey .Almost every one of his heirs falls under the suspicion of the private investigator Benoit Blanc at some point, including Harlan’s caretaker, Marta a woman so pure of heart, she can’t lie without becoming physically ill. True to the form, no one’s stories seem to add up, the plot thickens, and twists and turns are thrown in and at the center of the movie.

The film has been marketed as a “fun, modern-day” murder mystery, and the many rapturous reviews have echoed this sense of whimsy. But as “Knives Out” unfolds, Mr. Johnson reveals that he’s not interested solely in entertaining his audience for a couple of hours — he has something to say about class and politics in a bold, direct way that is rare in major American studio movies.

Unfortunately, Mr. Johnson’s ambitions on this front reminded me that sometimes, well-intentioned art can backfire and offend those it’s intended to champion. Through the character of Marta, “Knives Out” has a tendency to exploit its story’s immigration angle, which left me feeling uneasy as strangers at the screening I attended laughed at real-life issues I’m genuinely frightened of.

None of Thrombeys seems to know or care where she’s really from, each time guessing a different country. This is played as a running gag that is ostensibly intended as a critique of white upper-class liberalism. Yet Mr. Johnson keeps Marta’s background a mystery to the audience as well, never allowing her any cultural specificity beyond being vaguely Latina.

The film takes pains to cast Marta as an outsider in other discomforting ways. During a family argument, the youngest in the family, an alt-right troll, calls Marta an ethnic slur. In another scene, she’s called upon to clarify whether her family came to the United States legally, or “the right way,” as one of the Thrombeys puts it. Another member of the family hints that he could have her mother deported because she’s undocumented. Several family members assert, patronizingly, to Marta that they have “always taken care of” her. 

I can imagine Mr. Johnson views this pile-on as a way to call attention to the microaggressions working-class immigrants face daily, but it’s troubling to see Marta saddled with so much real-world baggage. 

After viewing “Knives Out,” I became upset as I tried to explain to a group of mostly white friends that I felt as I had seen an entirely different movie from the one they were raving about. I’ve been in some of the situations Marta endures — being asked to prove my citizenship, feeling unsafe speaking Spanish — and the movie brought up so many of these unpleasant memories repeatedly to little narrative effect. Instead of enjoying the twists and turns of an entertaining film, I left the theater with emotional whiplash caused by what felt like empty virtue signaling.",1
18,DLC_DOC1_Parasite_Review_Pleasures.docx,"On one side of town are the nouveau-riche Parks—a cheerfully culture-free husband and his lovely, silly wife raising their two spoiled kids in a resplendently modern house. (The house amounts to a major character in the drama. It’s a repository of genuine culture, by virtue of its architecture. What’s more, it is haunted, though not by conventional ghosts.)

On the other side of town, in a squalid apartment infested by stink bugs, live the Kims. They are counterparts of the Parks as reflected in a no-funhouse mirror—bummed-out husband, resilient wife, cheerful son who keeps flunking his college entrance exams, and cynical daughter who couldn’t get into art school, all of them down on their luck and out of work. But the Kims, as changeable luck would have it, are gifted hustlers, and they grab their main chance when the son, Ki-woo, gets hired as an English tutor for the Parks’ pretty daughter. With that beachhead established, Ki-woo’s father, mother and sister soon score jobs of their own with the Park family—under fake identities and false colors, but with a blithe alacrity that sweeps away all questions of plausibility.

The filmmaker puts his marvelous cast through its comic paces with exquisite precision and grace. Another component is the deliciousness of its humor, which plays not only on the Parks’ hilarious pretensions but on the Kims’ zest for their new roles as they take over growing areas of their employers’ lives. “What you need is vigor,” a suddenly authoritative Ki-woo tells Park Da-hye, his impressionable and eminently nubile student. He’s got it, and she gets it whenever he visits her room.

Instead of rich against poor, it’s a portrait of rich and poor in a precarious balance of mutual needs and benefits. “This is so metaphorical,” Ki-woo likes to say with a mixture of youthful pomposity and genuine wonder; the first time he says it is when a friend gives him a gift of a scholar’s rock, a hunk of stone that can represent whatever he chooses. “Parasite” is metaphorical too, but never calls attention to the fact. In its oddball specificity it simply stands—though never simply—as a representation of how society functions more often than not.

And it is deep. Just how deep is for me to hint at carefully and for you to discover when you see it—and see it you must if you’re open to one of the most remarkable films to hit the big screen in years. Suffice it to say that the light and delicate tone takes a gradual turn into Stygian darkness; that the title is more ambiguous than it may seem, since it’s hard to determine exactly who is living off whom; that the smell of the unwashed poor as experienced by the fastidious rich figures significantly in the plot; and that the shock at the end of “Mother” is kid stuff alongside the shock and awe of this climax. It’s a vision of the underclass rising up from far under, with all the delicacy of an erupting volcano.",1
19,JM_Doc2__Anchorman__delivers_comedic_goods.docx,"Sometimes the key to satire is to stay fairly close to the source. ""Anchorman,"" like ""This Is Spinal Tap,"" works best when it's only a degree or two removed from the excesses of the real thing. When the news director goes ape over stories about cute animals at the zoo, when the promos make the news ""team"" look like a happy family, the movie is right on target. But when rival local news teams engage in what looks like a free-for-all from a Roman arena, it doesn't work. Most of the time, though, ""Anchorman"" works, and a lot of the time it's very funny.



The movie centers on Ron Burgundy (Will Ferrell), the legendary top local anchor in San Diego in the early 1970s. Ron has bought into his legend, believes his promos, and informs a blonde at a pool party: ""I have many very important leather-bound books, and my apartment smells of rich mahogany."" His weakness is that he will read anything that is typed into his prompter. Anything. The words pass from his eyes into his mouth without passing through his brain.



As ""Anchorman"" opens, Ron Burgundy faces a crisis. Ed Harke, the stations news director, played by the invaluable Fred Willard, wants to add ""diversity"" to the newsroom by hiring a woman -- no, a WOMAN! -- as Burgundy's co-anchor. This cannot be. It is not right. It is against nature. Burgundy is appalled. The new co-anchor will be the efficiently named Veronica Corningstone (Christina Applegate), and yes, reader, she was the blonde that Burgundy tried to pick up with the leather and mahogany line.



The other news team members include the wonderfully named Champ Kind (David Koechner), Brick Tamland (Steven Carell) and Brian Fantana (Paul Rudd). And yes, sometimes when they're together, they actually do sing ""Afternoon Delight."" They are united in their fear of adding a woman to the team. ""I read somewhere,"" one of them ominously warns, ""that their periods attract bears."" Odors play an important role in the movie. Hoping to attract Corningstone, Brian Fantana splashes on a high-octane cologne that smells, the newsroom agrees, ""like the time the raccoon got in the copier.""

If the movie simply focused on making Ron and his team look ridiculous, it might grow tedious, because that would be such an easy thing to do. But it has a kind of sweetness to it. Despite his weaknesses, Ron is sort of a nice guy, darn it all, and Veronica Corningstone, despite her desire to project a serious image, kinda likes the guy -- especially when he reveals an unsuspected musical talent in a lounge one night, after he's asked to ""sit in on jazz flute.""

When the news teams clash in a free-for-all, it's over the top. But a lot of the quieter moments of rivalry are on target. I have known and worked with a lot of anchorpersons, even female anchorpersons, over the years, and I can tell you that almost all of them are good people -- smart professionals who don't take themselves too seriously. But every once in a while you get a Ron Burgundy, and you kind of treasure him, because you can dine out on the stories for years.",1
20,TAM_Doc1_Reservoir_Dogs_1992.docx,"Now that we know Quentin Tarantino can make a movie like ""Reservoir Dogs,"" it's time for him to move on and make a better one.

This film, the first from an obviously talented writer-director, is like an exercise in style. He sets up his characters during a funny scene in a coffee shop, and then puts them through a stickup that goes disastrously wrong. Most of the movie deals with its bloody aftermath, as they assemble in a warehouse and bleed and drool on one another.

The movie has one of the best casts you could imagine, led by the legendary old tough guy Lawrence Tierney, who has been in and out of jail both on the screen and in real life. He is incapable of uttering a syllable that sounds inauthentic. Tierney plays Joe Cabot, an experienced criminal who has assembled a team of crooks for a big diamond heist. The key to his plan is that his associates don't know one another, and therefore can't squeal if they're caught. He names them off a color chart: Mr. White, Mr. Orange, Mr. Blonde, Mr. Pink, and so on. Mr. Pink doesn't like his name. ""You're lucky you ain't Mr. Yellow,"" Tierney rasps.

The opening scene features an endlessly circling camera, as the tough guys light cigarettes and drink coffee in one of those places where the tables are Formica and the waitresses write your order on a green-and-white Guest Check. They argue, joke and b.s. each other through thick clouds of smoke; it's like ""The Sportswriters on Parole."" There's a funny discussion of tipping. Then they walk out of the restaurant, and are introduced in the opening credits, as they walk menacingly toward the camera. They have great faces: The glowering Michael Madsen; the apprehensive Tim Roth; Chris Penn, ready for anything; Tierney, with a Mack truck of a mug; Harvey Keitel, whose presence in a crime movie is like an imprimatur.

The movie feels like it's going to be terrific, but Tarantino's script doesn't have much curiosity about these guys. He has an idea, and trusts the idea to drive the plot.

The idea is that the tough guys, except for Tierney and the deranged Madsen, are mostly bluffers. They are not good at handling themselves in desperate situations.

We see the bungled crime in flashbacks. Tarantino has a confident, kinetic way of shooting action - guys running down the street, gun battles, blood and screams. Then the action centers in the warehouse, where Madsen sadistically toys with a character he thinks is a cop, and the movie ends on a couple of notes of horrifying poetic justice.

One of the discoveries in the movie is Madsen, who has done a lot of acting over the years (he had a good role in ""The Natural"") but here emerges with the kind of really menacing screen presence only a few actors achieve; he can hold his own with the fearsome Tierney, and reminds me a little of a very mean Robert De Niro.

Tarantino himself is also interesting as an actor; he could play great crazy villains.",1
21,OHU_Doc2_Parasite.docx,"Such a statement has become overused to such a degree that it’s impossible to be taken seriously, like how too many major new movies are gifted the m-word: masterpiece. So how do critics convey when a film truly is unexpectedly, brilliantly unpredictable in ways that feel revelatory? And what do we do when we see an actual “masterpiece” in this era of critics crying wolf? Especially one with so many twists and turns that the best writing about it will be long after spoiler warnings aren’t needed? I’ll do my best because Bong Joon-ho’s “Parasite” is unquestionably one of the best films of the year. 



Bong has made several films about class but “Parasite” may be his most daring examination of the structural inequity that has come to define the world. It is a tonal juggling act that first feels like a satire—a comedy of manners that bounces a group of lovable con artists off a very wealthy family of awkward eccentrics. Can the poor really just step into the world of the rich? The second half of “Parasite” is one of the most daring things I’ve seen in years narratively. Bong holds it all together, and the result is breathtaking.

Kim Ki-woo (Choi Woo-sik) and his family live on the edge of poverty. 

The script for “Parasite” will get a ton of attention as it’s one of those clever twisting and turning tales for which the screenwriter gets the most credit but this is very much an exercise in visual language that reaffirms Bong as a master. Working with the incredible cinematographer Kyung-pyo Hong and an A-list design team, Bong's film is captivating with every single composition. The clean, empty spaces of the Park home contrasted against the tight quarters of the Kim living arrangement isn’t just symbolic, it’s visually stimulating without ever calling attention to itself.

""Parasite"" is a marvelously entertaining film in terms of narrative, but there’s also so much going on underneath about how the rich use the poor to survive in ways that I can’t completely spoil here. Suffice to say, the wealthy in any country survive on the labor of the poor, whether it’s the housekeepers, tutors, and drivers they employ, or something much darker. Kim's family will be reminded of that chasm and the cruelty of inequity.

The social commentary of ""Parasite"" leads to chaos, but it never feels like a didactic message movie. It is somehow, and I’m still not even really sure how, both joyous and depressing at the same time. Stick with me here. ""Parasite"" is so perfectly calibrated that there’s joy to be had in just experiencing every confident frame of it, but then that’s tempered by thinking about what Bong is unpacking here and saying about society, especially with the perfect, absolutely haunting final scenes. It’s a conversation starter in ways we only get a few times a year, and further reminder that Bong Joon-ho is one of the best filmmakers working today.",1
22,MT_Doc1_With_Frozen2_Disney.docx,"With “Frozen II,” Disney has done the impossible: It’s made a terrific animated-musical sequel.



Over the past 25 years, the studio has released a heap of direct-to-video follow-ups to its biggest hits, such as “Return of Jafar” and “The Lion King 1½.” All of them have been forgettable at best, forever banished to the darkest corners of Disney+.



But the curse has been lifted. The second “Frozen” is even better than the first, with dazzling animation and a more mature and tuneful score. Call it “The Icicle Strikes Back.”



Elsa once sang, “I’m never going back! The past is in the past!” And “Frozen II” has wisely followed that path. Instead of rehashing the 2013 film, and piling on complications involving the queen’s magical ability to freeze with her fingertips, we start fresh with a new, out-of-the-icebox adventure.



Our heroine now sits on the throne of Arendelle, but despite the highs of being queen, Elsa (Idina Menzel) feels a nagging void. She begins hearing a siren song calling her into the distance when a supernatural force ravages the kingdom. She believes that the ethereal song, and the source of the damage, are both from an enchanted forest her mom told her about as a kid. Could it also hold the key to her magical powers? So, off she goes, along with sister Anna (Kristen Bell), snowman Olaf (Josh Gad), doofy Kristoff (Jonathan Groff) and Sven the reindeer.



The most important question for parents: What song will I be forced to play in the car on an endless loop until what seems like the end of time? That would be “Into the Unknown,” which Elsa belts out before embarking on her journey. It’s a rousing number that nicely sums up the movie’s more adult blend of darkness and whimsy, with more world-weary lyrics like, “I’ve had my adventure. I don’t need something new. I am afraid of what I’m risking if I follow you.” It’s also got a bang-up cover by Panic! At the Disco.



Once we’re in the woods, a land magically barricaded from the outside world, Disney’s prettiest landscapes and characters since 2017’s “Coco” come to life. The first “Frozen” vastly exceeded box-office expectations, and its sequel looks much more big-budget as a result. The hot-pink fire demon pulses with color, and the rock ogres look as good as any creature in “The Lord of the Rings.”



Don’t worry — it’s not all monsters and deep meaning. The music, by Oscar winners Robert Lopez and Kristen Anderson-Lopez, is actually much funnier this time around. Gad’s Olaf sings a delightful song — as he’s being chased by terrors in the forest — about how everything will make sense when he’s older. And Groff sounds great as Kristoff during a country-tinged ballad that looks like a Carly Simon video.



That tune is called “Lost In the Woods,” but the “Frozen” franchise is very much found in the forest. Elsa’s powers and insecurities are still the star, of course, but this film should confirm to Disney just how perfect this entire ensemble of characters is.",0
23,MAM_Doc1_Tommy-Boy.docx,"""Tommy Boy"" is one of those movies that plays like an explosion down at the screenplay factory. You can almost picture a bewildered office boy, his face smudged with soot, wandering through the ruins and rescuing pages at random. Too bad they didn't mail them to the insurance company instead of filming them.

The movie is an assembly of clichés and obligatory scenes from dozens of other movies, all are better. It has only one original idea, and that's a bad one: The inspiration of making the hero's sidekick into, simultaneously, his buddy, his critic and his rival.

It's like the part was written by three writers locked in separate rooms.

""Tommy Boy"" stars Chris Farley of ""Saturday Night Live,"" the guy with the size 23 neck, as Tommy Callahan, the dopey son of a Sandusky brake shoe manufacturer. His father, Big Tom (Brian Dennehy), is proud of him even though he squeaked through college in seven years, and supplies him with an office and big responsibilities when he comes back to Ohio. Meanwhile, there are startling developments on the domestic front, where Big Tom, a widower, is engaged to marry the bodacious Beverly (Bo Derek).

Young Tommy is overjoyed, because Beverly has a son, Paul (Rob Lowe), which means Tommy at last will have the brother he always dreamed of. Paul doubts there's much to do in Sandusky, but Tommy proves him wrong, introducing him to the favorite local pastime, ""cow tipping,"" which means sneaking up on sleeping cows and tipping them over. In other hands this could have been the movie's only funny scene, but director Peter Segal doesn't have a clue about comic payoffs and bungles it before ending with the desperate director's ancient standby, as the lads fall in the mud.

The plot thickens. Or does it congeal? I began ticking off the story clichés: We'd already had (1) dumb son returns to family business and (2) unexpected stepmother. Soon we get (3) company gets in trouble and all workers will lose jobs, (4) it's up to the kid to save the day, (5) evil stepmother, (6) road movie and (7) buddy picture. The last two come as Tommy hits the road in a desperate last-minute bid to sell brake shoes, accompanied by his friend Richard (David Spade, also from ""Saturday Night Live""). Richard has been introduced as a resentful employee who doesn't think Tommy should get such a quick promotion. Now he becomes a sidekick, critic, rival and buddy, all wrapped in one ungainly package.



No one is funny in ""Tommy Boy."" There are no memorable lines. None of the characters is interesting except for the enigmatic figure played by Rob Lowe, who seems to have wandered over from ""Hamlet."" Judging by the evidence on the screen, the movie got a green light before a usable screenplay had been prepared, with everybody reassuring each other that since they were such funny people, inspiration would overcome them. It was Forrest Gump, I believe, who said, ""Funny is as funny does.""",0
