,DSI_Title,Text,category
48,VP_Doc1_Blade-Runner.docx,"The strangest thing about the future is that this is now the future we once foretold. Twenty years ago, we thought of ""now"" as ""the year 1982,"" and we wondered what life would be like. Little could we have guessed that there would be no world government, that the cars would look like boxes instead of rocket ships, and that there would still be rock 'n' roll on the radio.

""Blade Runner"" asks us to imagine its own future, in ""the year 2020."" The movie takes place in a Los Angeles that looks like a futuristic Tokyo, with gigantic billboards showing smiling Japanese girls drinking Coca-Cola. I would have predicted L.A. would be Hispanic, but never mind. It looks sensational.



The city is dominated by almost inconceivably huge skyscrapers that look like the Merchandise Mart, times ten. People get around in compact vehicles that fly, hover, climb and swoop. (In a lot of fictional futures, people seem to zip around the city in private aircraft; can you imaging the traffic problems?) At ground level, however, the L.A. of the future is an urban jungle.

The movie stars Harrison Ford as a cop who moves confidently through the city's mean streets. He is laconic, cynical, competent. He has a difficult assignment. A group of ""replicants,"" artificial people who seem amazingly human, have escaped from ""off-world,"" and are trying to inflict themselves on Earth.

Ford's job is to track them down and eliminate them. Anyone who has read this far can predict what happens next: He falls in love with one of the replicants. She may not be quite human, but, oh, you kid.

This basic story comes from a Philip K. Dick novel with the intriguing title, ""Do Androids Dream of Electric Sheep?"" The book examined the differences between humans and thinking machines, and circled warily around the question of memory: Does it make an android's personal memories less valid if they are inspried by someone else's experiences -- especially if the android does not know that?

Ford says he originally signed on for ""Blade Runner"" because he found such questions intriguing. For director Ridley Scott, however the greater challenge seemed to be creating that future world. Scott is a master of production design, of imagining other worlds of the future (""Alien"") and the past (""The Duellists"").

He seems more concerned with creating his film worlds than populating them with plausible characters, and that's the trouble this time. ""Blade Runner"" is a stunningly interesting visual achievement, but a failure as a story.

The special effects were supervised by Douglas Trumbull, whose credits include ""2001: A Space Odyssey"" and ""Silent Running,"" and who is about as good as anyone in the world at using miniatures, animation, drawings, optical effects and other ways of tricking the eye.

The visual environments he creates for this film are wonderful to behold, and there's a sense of detail, too; we don't just get the skyways and the monolithic skyscrapers and the sky-taxis, we also get notions about how restaurants, clothes and home furnishing will look in 2020 (not too different). ""Blade Runner"" is worth attending just to witness this artistry.",0
49,LAR_Doc2_Lord_Ring_Return.docx,"A “King” that earns its crown, Peter Jackson’s final installment in his monumental “The Lord of the Rings” represents that filmmaking rarity — a third part of a trilogy that is decisively the best of the lot. With epic conflict, staggering battles, striking landscapes, and effects, and resolved character arcs all leading to a dramatic conclusion to more than nine hours of masterful storytelling, “The Return of the King” is urgently paced without an ounce of fat. 



Unlike other trilogy finales, this one will rank with its predecessors at the box office.  In “The Godfather,” and “Star Wars”, the second film was by consensus the best and most adventurous.



What Jackson and New Line so boldly did right was to shoot all three in one continuous stretch rather than start from scratch each time.



Of all the wonders associated with these films — the well-structured overall script, the perfection of the New Zealand locations, the visionary scenic designs, the exceptional visual effects, the costumes, hair and armor, and the excellent cast — perhaps the most impressive feat of all has been Jackson’s ability to keep it all in his head through the years and deliver a cohesive work with a proper sense of balance and proportion.



Unlike his predecessors in the trilogy business, of course, Jackson had a ready-made three-part text to work from, one constructed to pay off in the climactic installment.



“The days are growing darker,” Frodo observes, as he and Sam continue to be guided by the fretful Gollum (Serkis), whose intended treachery is superbly revealed in a schizophrenic soliloquy delivered to his reflection in the water. 



All the representatives of Middle-earth will have to come together for humanity to have a chance.  To this end, King Theoden of Rohan (Hill) summons all the men he can to march to Minas Tirith, joined by warriors Aragorn (Mortensen), Legolas (Bloom) and Gimli (Rhys-Davies), and followed eventually by his feisty niece Eowyn (Otto) and Pippin’s friend Merry (Monaghan). In Rivendell, Elf Arwen (Tyler), refuses immortality to remain alive for the sake of her great love, Aragorn.



The emotional momentum surges along with the physical action. After early ambivalence over his responsibility for the Ring, Frodo grows into the job; after long dodging his royal inheritance, Aragorn finally rises to the occasion; Sam emerges as a three-dimensional character of intense devotion to Frodo even after he has been tricked by Gollum and exiled by his closest friend.



The building sense of dread is palpable. Frodo’s arrival at the bowels of Mount Doom is charged not only with physical but a spiritual agony that triggers hesitation of nearly fateful consequences.  The siege of Minas Tirith may well be the mother of all cinematic battles.



Jackson pulled off one of the most ambitious and phenomenally successful dream projects of all time, a complete visual rendering of a 1,000-page literary classic beloved by countless readers internationally, a set of films that satisfies the Tolkien purists and will generate well upwards of $3 billion.",0
50,LAR_Doc1_Lord_Ring_Fellowship.docx,"The Fellowship of the Ring, Episode One in Peter Jackson’s three-part screen version of the massive tome that is J.R.R. Tolkien’s The Lord of the Rings, really gets those pages dancing. Fellowship is the real deal, a movie epic that pops your eyes out, piles on thrills and fun, and yet stays intimately attuned to character. Even when the film hits bumpy patches, it never flies off the rails. After the close of a year of botch jobs — The Mummy Returns, Jurassic Park III, Lara Croft: Tomb Raider — Jackson is the wizard who gets it right.



Jackson pulls off a directing coup that should give George Lucas pause. It’s an amazing achievement, with a script that never allows computer-generated marvels to overwhelm the personal story. Jackson is the ringmaster of the year’s wildest spectacle.



As for the plot, no way can 1,000-plus pages of Tolkien be distilled succinctly. A ring with the power to destroy the world has passed from the dark lord Sauron to Frodo Baggins (Elijah Wood). Frodo is a hobbit, a munchkin-short, sweet-natured, furry-footed species with a love of peace and of smoking pipe weed. Gandalf the good wizard (Ian McKellen) tells Frodo it’s his mission to travel east to Mordor to dump that ring into Mount Doom. Frodo takes along three fellow hobbits, Sam (Sean Astin), Pippin (Billy Boyd) and Merry (Dominic Monaghan); two human warriors, Aragorn (Viggo Mortensen) and Boromir (Sean Bean); the archer elf Legolas (Orlando Bloom); and the dwarf Gimli (John Rhys-Davies). Counting Gandalf, who’s having his own problems with the corrupted wizard Saruman (the great Christopher Lee in fine horror fettle), that’s nine in the fellowship. The good nine are being chased by nine Ringwraiths, dark riders on dark horses.



Female characters are underdeveloped. As Arwen, the elf princess, Liv Tyler sounds cute speaking Elfish, but she fails to give her role a pulse. Despite the lushness of Lesnie’s cinematography and the shimmering beauty of d Shore’s music, the love story falls flat. It’s a shock that the reliably excellent Cate Blanchett lacks magic as the elf queen Galadriel; sadly, all the scenes in the elf land of Rivendell have that over lit theme-park tackiness.



All is well again when the characters test their moral mettle against the power of the ring. Frodo develops in maturity as the story progresses, and Wood plays the role with soulful conviction. Mortensen, in the film’s best performance, brings heroic stature to Aragorn, befitting a man descended from kings. Aragorn’s conflict with Boromir, given haunting complexity by Bean, strikes at the essence of brotherhood and roots the film in emotion.



It’s emotion that makes Fellowship stick hard in the memory. Jackson wisely ends the film not with fireworks but with a small scene that cements the friendship between Frodo and Sam, a character of growing importance that Astin portrays with just the right notes of fun and feeling. Jackson deserves to revel in his success. He’s made a three-hour film that leaves you wanting more.",0
51,JKS_Doc1_The-Lord-of.docx,"'The Lord of the Rings: The Return of the King': THR's 2003 Review



The Return of the King. The sequel went on to win 11 Oscars at the 76th Academy Awards, including best picture and director. The Hollywood Reporter's original review is below. 



An epic success and a history-making production that finishes with a masterfully entertaining final installment, New Line Cinema's adaptation of J.R.R. Tolkien's The Lord of the Rings is a soaring legend in its own day and destined to be cherished for many ages to come. The Return of the King is the longest and most complicated of the three Rings films and probably fated to be the biggest moneymaker. Sure to be an Oscar contender in many categories and a breathtaking argument for director Peter Jackson winning every award there is to give, King has none of the usual deficiencies that frequently scuttle third films.



Frodo and Sam (Elijah Wood and Sean Astin), guided by the vengeful Gollum (again a wondrous combination of special effects and Serkis' inspired performance), finally enter Mordor, but the divisive influence of the Ring almost ends the fellowship of the two heroic Hobbits. When the three infiltrators pass by Minas Morgul (the dead city where the Nazgul reside), they watch another army of Sauron march to battle under the command of the Witch-king.



Eventually, this Black Captain of the Nazgul, who rides one of the dragonlike beasts first seen in Towers, has a fight with Eowyn and Merry in the Battle of the Pelennor Fields, outside the walls of Minas Tirith, that readers have been waiting decades to see. It's a gloriously crowd-pleasing moment, while overall the lengthy siege is tremendously exciting and visually unparalleled.



Huge elephan-tlike Mumakil and trolls pushing the giant battering ram known as Grond join hordes of Orcs in a gargantuan assault on Minas Tirith, a fight which faithless Denethor turns away from when he gives into fear and fatherly pride by sending Faramir to certain death. It's the leadership-tested Gandalf who commands the defense of the city. Although Denethor comes off too as enigmatic compared to the original material, he sure has a spectacular final scene.



Jackson and co-writers Philippa Boyens and Fran Walsh make noteworthy departures from Tolkien, including such crucial moments as what happens when Frodo is finally standing on a ledge over the Crack of Doom inside the volcano where the ring must be destroyed, and how Aragorn makes use of the Army of the Dead that only he can command. 



There are only brief moments with the saga's Elvish beauties: Arwen refuses to abandon Aragorn. Galadriel makes a crucial connection with Frodo near the story's climax. Dwarf fighter Gimli provides much-appreciated humor with his sarcastic remarks. Fearless Elf bowman Legolas delivers the best battlefield action, while wise Elrond provides Aragorn with the restored sword that defeated Sauron long ago.



The thunderous conclusion to the story of the Ring that includes the end of Frodo's journey and the battle outside the Black Gate winds down to a sublime denouement, leaving only 20 minutes to wrap up when Tolkien took a hundred pages.",0
52,DLC_DOC2_Parasite_Gisaengchung_Film.docx,"Korean creature-feature maestro Bong Joon-ho returns to Cannes with a dark family farce where the only monsters are human.

South Korean auteur Bong Joon-ho launches a sustained attack on the lifestyles of the rich and shameless with his latest Cannes competition contender, Parasite. He ditches the metaphorical layers and adopts a register closer to social realism, albeit spiced with dark satire and noir-ish thriller elements. Whatever the horror-movie connotations of that double-edged title, the morally flawed monsters in Parasite are entirely human.

Parasite is cumbersomely plotted and heavy-handed in its social commentary.That said, this prickly contemporary drama still feels more coherent and tonally assured than Snowpiercer or Okja, and packs a timely punch that will resonate in our financially tough, politically polarized times. 

From the opening scene, Bong sets up a stark visual contrast between the unequal social castes at play here. Disheveled patriarch Ki-taek (Song Kang-ho) and his family are crammed into a sunken, cluttered, bug-infested basement apartment at the end of a shabby street on the wrong side of the tracks. Ki-taek, his wife Chung-sook (Chang Hyae-jin), son Ki-woo (Choi Woo-shik) and daughter Ki-jung (Park So-dam) are all penniless and unemployed, unable to even hold down a lowly shared job folding cardboard pizza boxes. Without bad luck, they would have no luck at all.

But fortune favors the bold, especially when the bold are armed with flexible ethics and sharp forgery skills. Following a tip from a well-connected pal, Ki-woo lands a sweet job as a private tutor for Da-hye, the high-schooler daughter of wealthy corporate CEO Mr. Park and his glamorously vacant wife Yeon-kyo. In contrast to Ki-taek’s family, the Parks live high above the city in an airy, spacious, pristine modernist mansion shielded by thick concrete walls. A quick-thinking opportunist, Ki-woo spots a chance of securing jobs for his entire clan with the Parks, playing on their snobbish aspirations like a virtuoso. The plan runs smoothly, even if it means callously displacing the family’s existing domestic staff.

Initially a little slow to set up its dynamic tension, Parasite peaks during its lively mid-section as a fast-paced, black-hearted, Coens-esque farce before climaxing with a chaotic orgy of vengeful violence. As ever, Bong’s bludgeoning attacks on economic injustice have more passion than nuance, while a superfluous coda about secret coded messages is a clumsy twist too far. A good 15 minutes of the pic’s generous two-hour-plus running time could be comfortably trimmed.

Nonetheless, Parasite is generally gripping and finely crafted, standing up well as Bong’s most mature state-of-the-nation statement since Memories of Murder in 2003. The performances are uniformly solid, with special credit due to the child and teen actors. Hong Kyung-pyo’s high-gloss cinematography combines lustrous candy-shop colors with kinetic precision, while Lee Ha-jun’s production design is typically superb, especially the elegantly minimalist Park family mansion, which serves as both deluxe fortress and sinister prison. Spliced into Jung Jaei-il’s dread-laden score, fragrant bouquets of classical music provide bustling comic counterpoint as well as wry commentary on the snooty cultural values being slowly eviscerated onscreen.",1
53,KWB_Doc1_Artemis-Fowl-Review.docx,"For starters, it’s no Harry Potter. But when Aretmis Fowl debuts on Disney + on June 12th, you’ll wonder why this fussed-over and broken film version of Irish author Eoin Colfer’s young-adult bestseller — about a 12-year-old criminal mastermind — had to be this dramatically inert and emotionally barren. Colfer once described his fantasy series of eight Artemis novels as “Die Hard with fairies.” If only. What’s on screen comes up short on excitement despite the presence of some heady talent at the helm.. Try as they might, their efforts never achieve liftoff for a production that’s been languishing in development hell since the dawn of the 21st century. Colin Farrell, who seems to enjoy letting out the natural Irish lilt in his voice. Too bad he disappears from the film and his son’s life so often, leaving Arty (as dad calls him) rattling around in the luxurious Fowl manor in the care of Domovoi Butler (Nonzo Anozie). Arty dresses in Men in Black suits and shades, but his purported evil genius is nowhere in evidence. This is not Colfer’s morally compromised tween villain, but a relatable lonely boy who is glimpsed early hopping on a surfboard before schoolto show why Ireland is indeed “the most magical place on earth.”Sadly, said magic is otherwise in short supply. As the film begins, we learn that Arty’s mother has died, and Dad is a person of interest in some of the biggest robberies of the last 10 years (the Rosetta Stone and the Book of Kells are missing). Artemis Sr. keeps a lot of secrets — wait until you see his basement — but he does find the time to teach his boy about leprechauns, banshees, sprites, goblins and the fairies who live underground. Blarney? The movie comes front-loaded with exposition to help those who never read all or any of the books. Most of the verbalizing emanates from Mulch Diggums (Josh Gad), a giant dwarf (?) being questioned throughout the film by MI6. It helps that the fairies are ruled by Commander Root, cheekily played by Dame Judi Dench with a shock of white hair and voice that sounds like she gargled with gravel. Or something like that. Shaw, a prototypical sweet kid, isn’t given a chance to portray the Arty of the books, who came off like a calculating Mini-me of Die Hard villain Hans Gruber. Luckily, the movie is purloined right out from under Shaw by the delightful McDonnell, who plays Holly like pixie with attitude, a Tinker Belle so eager to become a real soldier in the fairy army that she could bust.The Disney version of Artemis Fowl covers everything in a blanket of bland that suggests the dull juvenilia  rather than the vigorous battle between good and evil that marked the novels. Instead, worlds collide at an Italian wedding where an escaped goblin goes on a rampage. “Most humans are afraid of gluten,” says Mulch, noting that there’s no way they can handle a goblin. The best way to handle this relentlessly nice movie that deserved a touch of nasty, is to enjoy the few flashes of what have been before the sheer heaviness of the production stomps out all the fun.",0
54,JC_Doc2_Terminator-Judgement-Day.docx,"While ""The Terminator"" was a great horror film, ""Terminator 2: Judgment Day"" is a great action film. While ""The Terminator"" was about the horror of an unstoppable harbinger of a technologically-advanced but soul-dead present, ""Terminator 2"" is, like so many action films before it, a paradoxically violent screed against violence. The film's reactionary politics are essentially dated, though there are several modern fanatics who embody the paranoiac impulses that compel self-styled freedom fighter Sarah Connor (Linda Hamilton) to fight against mental institutions, the police, and common sense to stop artificially-intelligent computer system Skynet from obliterating humanity in a nuclear war. 

But it's important to note that Sarah is not the heroine of ""Terminator 2"" as she was in ""The Terminator,"" but rather a supporting character who helps raise both estranged son John (Edward Furlong) and cyborg bodyguard/surrogate dad T-101 (Arnold Schwarzenegger). The T-101 is the main character in ""Terminator 2"" since he, as he boasts, is a ""learning machine,"" capable of progressive adaptation. This was the path to war in the era of George H.W. Bush bipartisanship: using one lethal system to combat a more threatening system. Robots don't kill people—people kill people. 

The T-101's burgeoning ersatz humanity makes Schwarzenegger a perfectly re-purposed tool. Director James Cameron had to convince the Austrian Oak to turn his humanoid baddie into a good guy, a jarring transition that was partly difficult for Schwarzenegger to stomach due to the prior failure of ""Conan the Destroyer,"" another sequel that was relatively lighter than its predecessor. But the T-101's role change works as well as it does because viewers—both then and now—don't necessarily expect Schwarzenegger's deadpan killing machine to be capable of serving as anybody's Jiminy Cricket-like moral compass. Still, that's exactly what the T-101 does when he re-unites John with Sarah, and learns from both characters first-hand the value of preserving human life.

The T-101's change from a villain to a hero also reflects the ambivalent optimism at the heart of ""Terminator 2."" Some cogs in the system can be retrained, but not all systems are benign. The psychiatric institution, represented by vainglorious Dr. Silberman (Earl Boen), is tellingly dismissed since it keeps singular iconoclasts like Sarah down, and convinces them that they must genuinely want to re-assimilate rather than just mimic a desire to change (in ""Terminator 2,"" bad machines are good mimics, but good people are bad mimics). The cops, represented by the confounded detectives who interrogate Sarah about her connection to the T-101 and the gas-mask-making SWAT team that tries to prevent the destruction of Skynet, are ineffectual, and hampered by a lack of emotional inspiration. 

But nuclear families, like the ones that surround well-meaning scientist Miles Dyson (Joe Morton) and good-natured survivalist Enrique Salceda (Castulo Guerra), are all positive since they represent a bright future that must be protected (hope must be preserved and defended instead of cultivated and maintained). So it makes sense that Sarah stops being a machine-like human, and starts acting like a human machine when she encounters Miles and Enrique.",0
55,OHU_Doc1_Sorry-To-Bother.docx,"Boots Riley’s “Sorry to Bother You” is an adrenalin-shot of a comedy and a fearless dissection of identity politics, corporate malevolence, and the American tendency to look the other way when confronted with horror. In this brilliant satire, people gather around their TVs every night to watch a show called “I Got the Sh*t Kicked Out of Me” and embrace a new lifestyle called WorryFree, which is very clearly corporate slavery advertised as something good for you. 

Don’t worry. “Sorry to Bother You” is no message-heavy, standard social commentary flick. It is a hysterical comedy, one of the funniest movies of the year. Just as in the music he created with The Coup, the message never gets in the way of the rhythm. Riley’s film wants, first and foremost, to entertain you, and it almost certainly will do that, especially if you’re willing to go with it on a funky journey, no matter where it takes you.

When he’s advised by a colleague (played by Danny Glover) to use his “white voice,” Cash starts to move up the corporate ladder quickly, eventually getting access to the golden elevator taken only by the “power callers.” They sell things people really shouldn’t be selling, and Cash is good at that too, drawing the attention of the maniacal Steve Lift (Armie Hammer) and the disgust of Detroit and his fellow co-workers, who have been struggling to unionize for worker’s rights.

There have been stories of men who sold their souls for success since people put pen to paper, but Riley loads his Faustian saga with enough social commentary to fill a dozen comedies. Every scene feels like it works on multiple registers. It’s much harder than it looks to make people laugh and think at the same time, and it’s that ingenious balance that makes Riley’s script for “Sorry to Bother You” so special. It never loses sight of its need to entertain along with the fact that it serves as a wake-up call for viewers to ask more questions about their priorities and those of people in power. It’s also cinematically striking, especially for a debut. From the fantastic costume design to the visual flights of fancy—such as when Cash and Detroit’s garage apartment literally transforms as Cash makes more money and a literal nod to Gondry in a corporate Claymation video—“Sorry to Bother You” has a confident visual language that so much comedy lacks. 



Great satires don’t hold back, and Riley turns most of his choices up to 11. That riskiness leads to a final act of insanity that will lose some people—both times I’ve seen the movie you could sense part of the theater tuning out as the movie takes a turn into sci-fi. For me, I love it when a filmmaker doesn’t pull back from the edge, but goes right over it. So while that part of the film may be weaker than what came before, I still respect the willingness to go there.",1
